Campus,Year,Session,Subject,Course,Detail,Section,Title,Professor,Enrolled,Avg,Std dev,High,Low,<50,50-54,55-59,60-63,64-67,68-71,72-75,76-79,80-84,85-89,90-100
UBCV,2019,W,PSYC,101,,901,Introduction to Biological and Cognitive Psychology,Alex Jian Tong Yu;Eva Zysk;Eve Limbrick-Oldfield;Monica Emode,52,68.807692308,14.831125804,92.0,0.0,2,4,3,8,2,9,8,8,3,2,3
UBCV,2019,W,PSYC,102,,006,"Introduction to Developmental, Social, Personality, and Clinical Psychology",Eva Zysk;Monica Emode;Xiaolei Deng,186,71.129032258,14.994215682,97.0,0.0,11,7,17,17,17,18,21,20,26,13,19
UBCV,2020,S,SPPH,538,,DL3,Application of Ethical Theories in the Practice of Public Health,Anita Ho;Monica Emode,31,85.838709677,5.657424468,95.0,71.0,0,0,0,0,0,1,1,1,7,12,9
UBCV,2020,W,PSYC,101,,005,Introduction to Biological and Cognitive Psychology,Elizabeth Zambrano Garza;Eva Zysk;Ke Zhang;Lexis Kepler;Lucille De Souza;Monica Emode;Shenaz Shahban,344,73.244186047,12.564641996,95.0,0.0,12,7,27,14,22,54,54,34,60,35,25
UBCV,2020,W,PSYC,102,,V02,"Introduction to Developmental, Social, Personality, and Clinical Psychology",Chandan Narayan;Eva Zysk;Lexis Kepler;Monica Emode,91,68.615384615,15.225540845,98.0,0.0,5,8,3,8,9,18,10,11,11,4,4
UBCV,2020,W,SPPH,516,,001,Methods for Systematic Reviews in Health Research,Lorri Puil;Monica Emode,25,82.24,3.821866909,87.0,73.0,0,0,0,0,0,0,1,4,14,6,0
