Campus,Year,Session,Subject,Course,Detail,Section,Title,Professor,Enrolled,Avg,Std dev,High,Low,<50,50-54,55-59,60-63,64-67,68-71,72-75,76-79,80-84,85-89,90-100
UBCV,2015,W,LFS,450,,001,"Land, Food, and Community III: Food System Sustainability",Marie-Claude Fortin;Sara Dawn Whitfield Elder;Sara Elder,38,76.763157895,13.405191029,90.0,33.0,,,,,5,,,,5,13,
UBCV,2019,W,ENVR,448,A,202,Directed Studies in Environmental Science,Sara Dawn Whitfield Elder;Sara Elder,7,89.0,4.795831523,93.0,80.0,0,0,0,0,0,0,0,0,1,1,5
UBCV,2019,W,LFS,250,,199,"Land, Food and Community I: Introduction to Food Systems and Sustainability",Adrienne Levay;Luis Melgarejo Perez;Sara Dawn Whitfield Elder;Sara Elder,29,78.103448276,10.379735847,97.0,60.0,0,0,0,3,4,1,1,4,8,4,4
UBCV,2020,W,ENVR,448,A,102,Directed Studies in Environmental Science,Sara Dawn Whitfield Elder;Sara Elder,6,88.166666667,5.455883674,97.0,81.0,0,0,0,0,0,0,0,0,1,3,2
UBCV,2020,W,LFS,250,,199,"Land, Food and Community I: Introduction to Food Systems and Sustainability",Celina Solis-Becerra;Marie-Claude Fortin;Sara Dawn Whitfield Elder;Sara Elder,29,79.896551724,9.969040746,95.0,55.0,0,0,1,0,4,1,3,1,6,7,6
