Campus,Year,Session,Subject,Course,Detail,Section,Title,Professor,Enrolled,Avg,Std dev,High,Low,<50,50-54,55-59,60-63,64-67,68-71,72-75,76-79,80-84,85-89,90-100
UBCV,2016,W,CIVL,300,,201,Construction Engineering and Management,Arash Shadkam;Peixian Li;Thomas Froese;Thomas M Froese;Tricia Curmi;Tricia Kathleen Curmi,137,77.24087591,9.564429773,92.0,0.0,1,0,1,2,4,21,23,21,42,15,7
UBCV,2016,W,CIVL,521,,201,Construction Methods and Performance,Arash Shadkam;Dana Vanier,20,83.1,2.245463262,86.0,78.0,0,0,0,0,0,0,0,1,11,8,0
UBCV,2017,W,CIVL,300,,201,Construction Engineering and Management,Arash Shadkam;Hanieh Daliri;Sheryl Staub-French,154,77.785714286,5.422013091,90.0,52.0,0,1,0,3,4,7,23,45,61,9,1
UBCV,2018,W,CIVL,425,,201,Case Studies of Construction Methods,Arash Shadkam;Dana Vanier,44,84.386363636,4.989365011,90.0,69.0,0,0,0,0,0,1,2,4,6,24,7
UBCV,2018,W,CIVL,521,,201,Construction Methods and Performance,Arash Shadkam;Dana Vanier,17,79.764705882,4.841608872,86.0,72.0,0,0,0,0,0,0,5,2,5,5,0
