Campus,Year,Session,Subject,Course,Detail,Section,Title,Professor,Enrolled,Avg,High,Low,<50,50-54,55-59,60-63,64-67,68-71,72-75,76-79,80-84,85-89,90-100,Median,Percentile (75),Percentile (25)
UBCV,2022,W,NURS,330,,001,Theoretical Perspectives in Nursing: Adults/Older Adults and their Families,Abdul-Fatawu Abdulai;Geertje Boschma;Sheila Mary McBurney;Ashley Scott;Lydia Wytenbroek,149,90.1,99.0,76.0,0,0,0,0,0,0,0,4,14,47,84,91.0,93.0,87.0
UBCV,2022,W,NURS,430,,002,Theoretical Perspectives in Nursing: Special Topics in Complex and Urgent Health Challenges across Settings/Populations,Nassim Adhami;Geertje Boschma;Sue Foster;Sheila Mary McBurney;Ashley Scott;Julie Anne Tipping,121,91.4,96.0,87.0,0,0,0,0,0,0,0,0,0,27,94,92.0,93.0,90.0
UBCV,2023,S,NURS,504,,941,Research and Evidence-Based Practice,Ashley Scott,28,89.9,98.0,72.0,0,0,0,0,0,0,1,0,4,6,16,92.0,94.0,85.5
UBCV,2023,W,NURS,330,,001,Theoretical Perspectives in Nursing: Adults/Older Adults and their Families,Nassim Adhami;Elisabeth Bailey;Sheila Mary McBurney;Ashley Scott;Julie Anne Tipping,149,87.15,96.0,70.0,0,0,0,0,0,1,2,5,35,59,47,88.0,91.0,84.0
UBCV,2023,W,NURS,430,,002,Theoretical Perspectives in Nursing: Special Topics in Complex and Urgent Health Challenges across Settings/Populations,Sheila Mary McBurney;Ashley Scott;Julie Anne Tipping;Lydia Wytenbroek,146,94.65,100.0,91.0,0,0,0,0,0,0,0,0,0,0,146,95.0,96.0,94.0
UBCV,2023,W,NURS,541,,001,Clinical Nursing Education,Nassim Adhami;Ashley Scott,13,95.62,99.0,91.0,0,0,0,0,0,0,0,0,0,0,13,96.0,98.0,94.0
UBCV,2023,W,NURS,586,H,002,Specialized Domains of Nursing Practice,Ashley Scott;Cheryl Segaric,21,90.29,95.0,86.0,0,0,0,0,0,0,0,0,0,9,12,90.0,92.0,89.0
