Campus,Year,Session,Subject,Course,Detail,Section,Title,Professor,Enrolled,Avg,Std dev,High,Low,<50,50-54,55-59,60-63,64-67,68-71,72-75,76-79,80-84,85-89,90-100
UBCV,2016,W,ARCH,403,,001,Themes in Architecture and Design,Emily Nadene Scoular;Emily Scoular;Leslie Van Duzer,31,85.80645161,5.647532528,97.0,73.0,0,0,0,0,0,0,2,2,7,13,7
UBCV,2017,W,ARCH,523,,001,Contemporary Theories in Architecture,Emily Nadene Scoular;Emily Scoular;Sherry Mckay,45,77.311111111,5.371736736,90.0,65.0,0,0,0,0,2,6,7,11,16,2,1
UBCV,2018,W,ARCH,504,C,001,Topics in Architectural History I (Pre-1900),Emily Scoular;Joseph Watson,28,81.785714286,5.452536908,92.0,70.0,0,0,0,0,0,2,1,6,9,9,1
UBCV,2018,W,ARCH,505,D,001,Topics in Architectural History II (1900-Present),Emily Scoular;Joseph Watson,19,83.421052632,5.13501909,90.0,68.0,0,0,0,0,0,1,0,2,7,6,3
UBCV,2018,W,ENDS,220,,001,Architecture in Context: Vancouver,Alicia Kingdon;Emily Scoular;Kristen Elkow;Neal Lamontagne,118,78.381355932,13.645023194,92.0,0.0,4,2,1,2,0,5,11,24,34,24,11
