Campus,Year,Session,Subject,Course,Detail,Section,Title,Professor,Enrolled,Avg,Std dev,High,Low,<50,50-54,55-59,60-63,64-67,68-71,72-75,76-79,80-84,85-89,90-100
UBCV,2020,W,LFS,350,,002,"Land, Food, and Community II: Principles and Practice of Community Food Security",Colin Dring;Daniel Sax;Janet Werker;Jennifer Grenz;Johanna Leoni Bock;Kirsten Stevens;Russell Goulet;Simone Dew;Tereza Cajkova;William Valley,146,85.691780822,7.934703409,98.0,46.0,1,0,0,0,1,6,9,13,20,44,52
UBCV,2020,W,UFOR,402,,101,"Urban Forestry Administration, Policy and Law",Cecil Konijnendijk;Kirsten Stevens;Sophie Nitoslawski;Tahia Devisscher,36,81.583333333,7.291384348,92.0,61.0,0,0,0,1,2,1,2,4,11,12,3
UBCV,2020,W,UFOR,402,,102,"Urban Forestry Administration, Policy and Law",Cecil Konijnendijk;Kirsten Stevens;Sophie Nitoslawski;Tahia Devisscher,10,78.8,5.940445176,86.0,66.0,0,0,0,0,1,0,2,2,3,2,0
UBCV,2021,S,UFOR,500,,921,Developing Green and Resilient Cities - The Urban Forestry Approach,Cecil Konijnendijk;Kirsten Stevens,11,85.909090909,6.803742286,97.0,75.0,0,0,0,0,0,0,1,0,5,1,4
UBCV,2021,W,UFOR,511,,101,Geomatics Principles and Applications,Amy Blood;Kirsten Stevens;Nicholas Charles Coops;Paul Pickell,10,78.4,29.231641912,96.0,0.0,1,0,0,0,1,0,0,1,1,1,5
UBCV,2021,W,UFOR,512,,101,Urban Forest Governance,Cecil Konijnendijk;Kirsten Stevens;Owen Croy,10,81.1,10.619165064,91.0,61.0,0,0,0,1,0,1,2,0,1,2,3
