Campus,Year,Session,Subject,Course,Detail,Section,Title,Professor,Enrolled,Avg,Std dev,High,Low,<50,50-54,55-59,60-63,64-67,68-71,72-75,76-79,80-84,85-89,90-100,Median,Percentile (75),Percentile (25)
UBCV,2017,S,NURS,552,,941,Methods in Nursing Science.,Mariko Liette Sakamoto;Mariko Sakamoto;Sabrina Wong,21,80.238095238,13.852453797,94.0,26.0,1,0,0,0,1,0,1,2,8,6,2,,,
UBCV,2017,W,NURS,330,,001,Theoretical Perspectives in Nursing: Adults/Older Adults and their Families,Elsie Tan;Jennifer Kryworuchko;Jillian Harding;Mariko Liette Sakamoto;Mariko Sakamoto,121,78.041322314,4.572374828,90.0,60.0,0,0,0,1,1,6,23,39,45,5,1,,,
UBCV,2018,S,NURS,354,,941,Theoretical Perspectives in Nursing: Complexities in Seniors Care,Alison Phinney;Cathryn Jackson;Elsie Tan;Hrag Yacoubian;Mariko Liette Sakamoto;Mariko Sakamoto,122,81.016393443,4.431263101,89.0,70.0,0,0,0,0,0,3,8,33,44,34,0,,,
UBCV,2021,W,NURS,542,,002,Social Epidemiology: Special Populations,Alison Phinney;Mariko Sakamoto,17,89.823529412,3.358483551,95.0,83.0,0,0,0,0,0,0,0,0,2,4,11,,,
UBCV,2021,W,NURS,542,,002,Social Epidemiology: Special Populations,Mariko Sakamoto,17,89.8,,95.0,83.0,,,,,,,,,,,11,90.0,92.0,89.0
