Campus,Year,Session,Subject,Course,Detail,Section,Title,Professor,Enrolled,Avg,Std dev,High,Low,<50,50-54,55-59,60-63,64-67,68-71,72-75,76-79,80-84,85-89,90-100
UBCV,2020,W,PHYS,219,,L1A,Intermediate Experimental Physics I,Adam Darcie;Adam Thomas Darcie;Andrzej Kotlicki;Fatemeh Aghaee Rad;Luke Alan Reynolds;Luke Reynolds;Md Shahriar Rahim Siddiqui;Robert Kiefl;Yukiya Saito,31,81.903225806,11.151546496,100.0,56.0,0,0,1,2,1,1,3,3,4,9,7
UBCV,2021,S,ASTR,333,,981,Exoplanets and Astrobiology,Deborah Good;Fengqiu Dong;Jeremy Heyl;Md Shahriar Rahim Siddiqui;Parham Zarei,99,81.858585859,11.723872472,99.0,0.0,1,0,1,2,4,6,1,16,21,27,20
UBCV,2021,W,DSCI,524,,001,Collaborative Software Development,Eric Lee;Hossameldin Ibrahim Said Mohammed;Man Yeung Tai;Maria Florencia D' Andrea;Md Shahriar Rahim Siddiqui;Melika Farahani;Shan Lu;Tiffany Leung;Tiffany Timbers;Zac Warham,114,97.473684211,3.069145701,100.0,80.0,0,0,0,0,0,0,0,0,2,1,111
UBCV,2021,W,DSCI,525,,001,Web and Cloud Computing,Abdul Muntakim Rafi;Daniel Ramandi;Eric Lee;Gittu George;Md Shahriar Rahim Siddiqui;Melika Farahani;Michael Feeley;Tiffany Leung;Zac Warham,114,98.350877193,2.065230306,100.0,92.0,0,0,0,0,0,0,0,0,0,0,114
UBCV,2021,W,DSCI,553,,001,Statistical Inference and Computation II,Abdul Muntakim Rafi;Gilberto Alexi Rodr�Guez Arelis;Hossameldin Ibrahim Said Mohammed;Md Shahriar Rahim Siddiqui;Michael Gelbart;Mohamad Amin Mohamadi;Mohit Pandey;Trevor Campbell;Yulia Egorova,114,96.605263158,3.483509625,100.0,79.0,0,0,0,0,0,0,0,1,0,5,108
