Campus,Year,Session,Subject,Course,Detail,Section,Title,Professor,Enrolled,Avg,Std dev,High,Low,<50,50-54,55-59,60-63,64-67,68-71,72-75,76-79,80-84,85-89,90-100,Median,Percentile (75),Percentile (25)
UBCV,2016,W,ARTH,344,,001,"Art and Photography in Canada, 1920 to the Present",John O'Brian;Sameena Sameena,64,75.8125,10.90489187,90.0,15.0,1,1,2,0,2,5,16,11,16,8,2,,,
UBCV,2019,W,ARTH,225,,001,Art in Europe to the Sixteenth Century,Sameena Sameena;Saygin Salgirli,49,80.510204082,9.094692704,92.0,44.0,1,1,0,0,2,1,3,6,16,14,5,,,
UBCV,2019,W,ARTH,362,,001,Art in Japan: Objects and Spaces,Ignacio Alberto Adriasola Munoz;Sameena Sameena,55,78.709090909,12.720168773,90.0,0.0,1,0,1,2,1,0,4,10,19,15,2,,,
UBCV,2020,W,ARTH,102,,001,Crisis and Contradiction in Art and the Built Environment,Jacqueline Witkowski;Sameena Sameena;Saygin Salgirli,110,80.4,13.771530266,96.0,0.0,3,0,3,1,0,5,9,10,26,29,24,,,
UBCV,2020,W,ARTH,225,,001,Art in Europe to the Sixteenth Century,Sameena Sameena;Saygin Salgirli,55,82.418181818,11.449876126,94.0,28.0,1,0,1,3,0,0,4,4,12,12,18,,,
UBCV,2021,W,ARTH,251,,001,Asian Arts: From Chinese Warriors to Bollywood Posters,Davin Luce;Sameena Sameena,54,78.037037037,11.116811955,91.0,13.0,1,0,0,0,3,0,10,19,0,19,2,,,
UBCV,2021,W,ARTH,380,,001,Art as Technology,Ignacio Alberto Adriasola Munoz;Jaleh Mansoor;Ji Eun Sung;Sameena Sameena,52,81.461538462,8.013374943,92.0,42.0,1,0,0,0,1,2,3,6,23,10,6,,,
UBCV,2021,W,ARTH,251,,001,Asian Arts: From Chinese Warriors to Bollywood Posters,Sameena Sameena,53,79.3,,91.0,64.0,,,,,,,10,19,,19,,79.0,85.0,76.0
