Campus,Year,Session,Subject,Course,Detail,Section,Title,Professor,Enrolled,Avg,Std dev,High,Low,<50,50-54,55-59,60-63,64-67,68-71,72-75,76-79,80-84,85-89,90-100
UBCV,2016,W,FIPR,230,,001,Introduction to Motion Picture Directing,David Hauka;Greg Coyes;Jason Karman,58,79.27586207,7.582975168,94.0,59.0,0,0,1,2,3,3,4,12,20,11,2
UBCV,2016,W,FIPR,234,,001,Production Planning and Professional Practices,Alexander Formos;Jason Karman;Sharon Mcgowan,63,80.17460318,11.94009197,98.0,24.0,1,1,1,1,4,1,6,8,12,16,12
UBCV,2017,W,FIPR,230,,001,Introduction to Motion Picture Directing,David Hauka;Greg Coyes;Jason Karman;Shannon Walsh,62,76.629032258,15.67835918,90.0,0.0,2,0,0,2,3,4,8,6,23,13,1
UBCV,2017,W,FIPR,233,,003,Film and Media Production I,Alejandro Yoshizawa;Jason Karman;Joe Perry,40,80.35,6.619900069,92.0,65.0,0,0,0,0,2,2,5,6,13,9,3
UBCV,2017,W,FIPR,234,,001,Production Planning and Professional Practices,Greg Coyes;Jason Karman;Sharon Mcgowan,59,80.13559322,18.546732798,98.0,0.0,4,0,0,2,1,1,4,7,11,10,19
UBCV,2018,W,FIPR,133,,001,Introduction to Film and Media Production,Jason Karman;Rob Wenzek,40,86.45,5.606543796,97.0,72.0,0,0,0,0,0,0,2,5,5,17,11
