Campus,Year,Session,Subject,Course,Detail,Section,Title,Professor,Enrolled,Avg,Std dev,High,Low,<50,50-54,55-59,60-63,64-67,68-71,72-75,76-79,80-84,85-89,90-100
UBCV,2017,W,ARTH,377,,001,Arts of the Northwest Coast Peoples: The South,Michelle Mcgeough,27,78.666666667,10.310562172,95.0,53.0,0,1,1,0,2,2,0,5,9,3,4
UBCV,2018,W,ARTH,262,,001,Indigenous Arts of North America,Michelle Mcgeough,28,79.75,10.054020755,93.0,57.0,0,0,1,1,1,2,3,5,2,8,5
UBCV,2018,W,ARTH,377,,001,Arts of the Northwest Coast Peoples: The South,Michelle Mcgeough,24,81.75,18.451463946,93.0,0.0,1,0,0,0,0,1,1,0,6,8,7
UBCV,2018,W,ARTH,476,,001,Seminar in North American Aboriginal Art,Michelle Mcgeough,13,80.923076923,12.730943527,94.0,53.0,0,1,0,1,0,0,2,1,2,1,5
UBCV,2019,W,ARTH,376,,001,Arts of the Northwest Coast Peoples: The North,Michelle Mcgeough,49,83.081632653,10.437984988,94.0,36.0,1,0,0,2,0,1,4,5,11,9,16
UBCV,2019,W,ARTH,397,A,001,Special Topics,Michelle Mcgeough,26,80.615384615,17.410518483,96.0,25.0,2,0,1,1,0,1,0,2,3,7,9
UBCV,2019,W,ARTH,561,A,001,Studies in the Indigenous Arts of the Americas,Michelle Mcgeough,7,91.0,1.914854216,93.0,87.0,0,0,0,0,0,0,0,0,0,1,6
UBCV,2019,W,ARTH,571,,001,The Methodology of Art History,Michelle Mcgeough;Tai Smith,13,88.615384615,2.754948927,94.0,85.0,0,0,0,0,0,0,0,0,0,9,4
