Campus,Year,Session,Subject,Course,Detail,Section,Title,Professor,Enrolled,Avg,Std dev,High,Low,<50,50-54,55-59,60-63,64-67,68-71,72-75,76-79,80-84,85-89,90-100
UBCO,2017,W,APSC,183,,101,Matter and Energy II,Anil Rajendra Prasad;Arash Dalili Shoaei;Humera Ahmed;John Alan Brereton;Mahyar Mohaghegh Montazeri;Pouria Mehrabi;Priscila Nunes Muniz Barreto;Rui Kai Miao;Saeed Ahmadi;Sarin Raj Pokhrel,154,79.149350649,12.198136827,98.0,0.0,3,2,2,7,4,13,16,15,38,31,23
UBCO,2017,W,APSC,183,,102,Matter and Energy II,Anil Rajendra Prasad;Arash Dalili Shoaei;Humera Ahmed;John Alan Brereton;Mahyar Mohaghegh Montazeri;Pouria Mehrabi;Priscila Nunes Muniz Barreto;Rui Kai Miao;Saeed Ahmadi;Sarin Raj Pokhrel,120,78.408333333,14.998877176,99.0,0.0,5,2,2,1,6,8,14,19,20,20,23
UBCO,2017,W,APSC,252,,101,Thermodynamics and Heat Transfer,Arash Dalili Shoaei;Grant Sonnenberg;Mohammad Haji Mohammadi;Pouria Mehrabi;Rui Kai Miao;Tharindu Hewa Godella Waththage;Tharindu Prbatha Hewa Godella Waththage;Yu Yan,147,60.700680272,20.647204516,100.0,14.0,45,10,12,9,11,4,10,14,13,9,10
UBCO,2017,W,APSC,252,,102,Thermodynamics and Heat Transfer,Arash Dalili Shoaei;Grant Sonnenberg;Mohammad Haji Mohammadi;Pouria Mehrabi;Rui Kai Miao;Tharindu Hewa Godella Waththage;Tharindu Prbatha Hewa Godella Waththage;Yu Yan,183,65.442622951,19.882781156,99.0,18.0,30,26,19,8,11,13,8,12,14,21,21
UBCO,2017,W,ENGR,385,,101,Heat Transfer Applications,Aiqing Lan;Anshuman Dey;Behzad Mohajer;Guoyu Zhang;Meitham Amerehbozchalouee;Ri Li;Rui Kai Miao;Yadi Cao,117,75.957264957,10.085319787,97.0,41.0,2,0,5,4,11,14,14,25,20,11,11
UBCO,2017,W,ENGR,484,,101,Heat and Mass Transfer,Ri Li;Rui Kai Miao,58,75.120689655,8.273987109,94.0,56.0,0,0,2,3,4,12,9,10,10,5,3
UBCV,2017,S,VANT,151,,VE1,Multidisciplinary Engineering Design Project,Niels De Vries;Rui Kai Miao;Seach Chyr Goh,67,71.104477612,8.716293222,84.0,39.0,1,2,3,6,8,9,14,17,7,0,0
