Campus,Year,Session,Subject,Course,Detail,Section,Title,Professor,Enrolled,Avg,Std dev,High,Low,<50,50-54,55-59,60-63,64-67,68-71,72-75,76-79,80-84,85-89,90-100
UBCV,2018,W,CHBE,356,,201,Process Dynamics and Control,Parya Keyvani;Yankai Cao;Yiting Tsai;Yu Pei,145,73.64137931,15.974665647,100.0,7.0,6,4,14,7,8,18,25,12,18,13,20
UBCV,2019,W,CHBE,484,,201,Green Engineering Principles and Applications for Process Industries,Anthony K Lau;Xiaotao Bi;Yu Pei,69,80.47826087,5.468112632,89.0,58.0,0,0,1,0,1,1,5,16,31,14,0
UBCV,2019,W,CHBE,485,,101,Air Pollution Prevention and Control,Anish Karnik;Anish Rajesh Karnik;Anthony K Lau;Pengpeng Fu;Yu Pei,167,81.047904192,9.17028227,94.0,0.0,1,0,0,1,6,6,13,35,43,38,24
UBCV,2020,W,APSC,183,,VE1,Matter and Energy II,Erik Joy;Seyyed Alireza Bagherzadeh Hosseini;W Scott Dunbar;Yu Pei,46,72.47826087,11.158930913,94.0,49.0,3,2,1,3,3,8,5,9,7,4,1
UBCV,2020,W,CHBE,370,,101,Fundamentals of Sustainable Engineering,Hui Zhu;Xiaotao Bi;Yan Yu;Yu Pei,144,76.5,6.48505544,92.0,59.0,0,0,2,2,11,10,43,22,41,9,4
UBCV,2021,W,APSC,183,,VE1,Matter and Energy II,Eric Lees;Fatemeh Asadi Zeidabadi;Leo Stocco;Seyyed Alireza Bagherzadeh Hosseini;Yu Pei;Zelai Xu,58,68.948275862,15.818512821,97.0,18.0,8,2,3,1,6,11,5,9,4,4,5
UBCV,2021,W,CHBE,370,,101,Fundamentals of Sustainable Engineering,Xiaotao Bi;Yan Yu;Yinzhao Wang;Yu Pei,180,76.894444444,5.573778617,92.0,44.0,1,0,1,4,2,7,50,56,56,1,2
