Campus,Year,Session,Subject,Course,Detail,Section,Title,Professor,Enrolled,Avg,Std dev,High,Low,<50,50-54,55-59,60-63,64-67,68-71,72-75,76-79,80-84,85-89,90-100
UBCV,2021,W,DSCI,512,,001,Algorithms and Data Structures,Abdul Muntakim Rafi;Christopher Nicholas Gubbels;Colby Delisle;Justin Chiasson;Melika Farahani;Michael Gelbart;Mobina Mahdavi;Yi Xuan Qi,150,92.053333333,6.926058824,100.0,67.0,0,0,0,0,3,0,0,3,18,19,107
UBCV,2021,W,DSCI,521,,001,Computing Platforms for Data Science,Abdul Muntakim Rafi;Joel Ostblom;Maria Florencia D' Andrea;Matthew Hoang Tu Nguyen;Michael Gelbart;Phan Anh Ngoc Bui;Pouya Ahmadvand;Shan Lu;Yi Xuan Qi;Yuxin Tian,149,94.187919463,3.684094974,100.0,78.0,0,0,0,0,0,0,0,2,1,9,137
UBCV,2021,W,DSCI,522,,001,Data Science Workflows,Abdul Muntakim Rafi;Eric Lee;Man Yeung Tai;Maria Florencia D' Andrea;Mohamad Amin Mohamadi;Peter Henry Gysbers;Qiuhan He;Tiffany Timbers,116,95.922413793,3.378064437,100.0,68.0,0,0,0,0,0,1,0,0,0,3,112
UBCV,2021,W,DSCI,525,,001,Web and Cloud Computing,Abdul Muntakim Rafi;Daniel Ramandi;Eric Lee;Gittu George;Md Shahriar Rahim Siddiqui;Melika Farahani;Michael Feeley;Tiffany Leung;Zac Warham,114,98.350877193,2.065230306,100.0,92.0,0,0,0,0,0,0,0,0,0,0,114
UBCV,2021,W,DSCI,553,,001,Statistical Inference and Computation II,Abdul Muntakim Rafi;Gilberto Alexi Rodr�Guez Arelis;Hossameldin Ibrahim Said Mohammed;Md Shahriar Rahim Siddiqui;Michael Gelbart;Mohamad Amin Mohamadi;Mohit Pandey;Trevor Campbell;Yulia Egorova,114,96.605263158,3.483509625,100.0,79.0,0,0,0,0,0,0,0,1,0,5,108
UBCV,2021,W,DSCI,572,,001,Supervised Learning II,Abdul Muntakim Rafi;Alireza Iranpour;Arman Seyed-Ahmadi;Dollina Dodani;Matthew Hoang Tu Nguyen;Mobina Mahdavi;Mohit Pandey;Tomas Beuzen,114,89.947368421,5.339520553,99.0,68.0,0,0,0,0,0,1,2,2,9,29,71
