Campus,Year,Session,Subject,Course,Detail,Section,Title,Professor,Enrolled,Avg,Std dev,High,Low,<50,50-54,55-59,60-63,64-67,68-71,72-75,76-79,80-84,85-89,90-100,Median,Percentile (75),Percentile (25)
UBCV,2020,W,EOSC,310,,99C,The Earth and the Solar System,Elisabeth Giroud;Francis Rossmann;Kirsten Hodge;Louise Longridge,163,87.441717791,9.689053362,99.0,0.0,1,0,0,0,1,3,4,11,25,44,74,,,
UBCV,2021,W,EOSC,110,,V01,The Solid Earth: A Dynamic Planet,Francis Rossmann;Shandin Pete,62,81.209677419,9.834927882,96.0,52.0,0,2,2,1,1,3,3,6,17,18,9,,,
UBCV,2021,W,EOSC,211,,101,"Computer Methods in Earth, Ocean and Atmospheric Sciences",Andrew Loeppky;Anya Jacksteit;Catherine Johnson;Francis Rossmann;Philip Austin;Sean Wanket,93,77.817204301,12.195817384,95.0,28.0,4,0,3,4,3,6,7,14,18,27,7,,,
UBCV,2021,W,EOSC,310,,99A,The Earth and the Solar System,Francis Rossmann;Jose Maria Valenti Muelas;Kirsten Hodge;Michael Lipsen,195,75.512820513,11.77423317,99.0,33.0,3,6,10,9,18,24,28,21,31,24,21,,,
UBCV,2021,W,EOSC,511,,201,"Numerical Techniques for Ocean, Atmosphere and Earth Scientists",Francis Rossmann;Rachel White;Susan Elizabeth Allen,17,86.647058824,2.760008525,92.0,83.0,0,0,0,0,0,0,0,0,4,10,3,,,
UBCV,2023,W,EOSC,211,,101,"Computer Methods in Earth, Ocean and Atmospheric Sciences",Luke Brown;Catherine Johnson;Francis Rossmann,94,86.5,,100.0,65.0,0,0,0,0,2,2,4,8,19,22,37,87.0,92.0,82.0
