Campus,Year,Session,Subject,Course,Detail,Section,Title,Professor,Enrolled,Avg,Std dev,High,Low,<50,50-54,55-59,60-63,64-67,68-71,72-75,76-79,80-84,85-89,90-100
UBCV,2015,W,LFS,150,,004,Scholarly Writing and Argumentation in Land and Food Systems,Elisabeth Helen Ormandy;Elisabeth Ormandy;Sarah Riddell,24,75.041666667,11.199686202,90.0,35.0,,,,,,,5,,5,,
UBCV,2015,W,LFS,252,,002,"Land, Food, and Community: Quantitative Data Analysis",Gabrielle Menard;Lucia Amendola Saavedra;Sarah Jane Riddell;Sarah Riddell;Sean Holowaychuk;Sean Louis Holowaychuk;Suvaporn Phasuk;Zeng Zhu,164,76.804878049,11.869886654,98.0,37.0,5,,,9,16,13,14,30,27,23,22
UBCV,2016,W,FRE,340,,001,International Agricultural Development,Sarah Riddell;Sean Holowaychuk;Sean Louis Holowaychuk,63,78.96825397,7.313196764,95.0,68.0,0,0,0,0,0,15,6,6,20,10,6
UBCV,2016,W,FRE,460,,001,Economics of Food Consumption,Carol Mcausland;Jiahe Miao;Sarah Riddell,50,76.92,7.88136526,91.0,51.0,0,1,0,1,4,7,8,5,16,7,1
UBCV,2016,W,LFS,252,,002,"Land, Food, and Community: Quantitative Data Analysis",Jingyu Bao;Lucia Amendola Saavedra;Michael Johnson;Michael Roger Johnson;Pacific Vuningoma;Sarah Jane Riddell;Sarah Riddell;Teresa Hao;Xiaohun Li;Ya Gao,181,76.90055249,9.393913498,95.0,50.0,0,5,6,4,16,19,23,27,36,37,8
UBCV,2016,W,LFS,450,,001,"Land, Food, and Community III: Food System Sustainability",Marie-Claude Fortin;Sarah Riddell,34,82.73529412,7.191361921,94.0,64.0,0,0,0,0,1,1,4,2,9,10,7
UBCV,2017,W,LFS,250,,198,"Land, Food and Community I",Marie-Claude Fortin;Sarah Riddell,31,73.451612903,14.732817585,100.0,38.0,1,1,5,0,3,2,2,5,5,4,3
UBCV,2017,W,LFS,450,,001,"Land, Food, and Community III: Food System Sustainability",Heather Holman;Liska Richer;Sarah Riddell,30,83.7,8.59490627,98.0,60.0,0,0,0,1,1,0,0,5,9,7,7
