Campus,Year,Session,Subject,Course,Detail,Section,Title,Professor,Enrolled,Avg,Std dev,High,Low,<50,50-54,55-59,60-63,64-67,68-71,72-75,76-79,80-84,85-89,90-100
UBCV,2016,W,ECON,326,,003,Methods of Empirical Research in Economics,Pablo Antonio Gutierrez Cubillos;Pablo Gutierrez Cubillos;Paul Schrimpf,64,81.5,8.037610006,94.0,56.0,0,0,1,1,2,3,8,4,20,14,11
UBCV,2017,S,ECON,325,,921,Introduction to Empirical Economics,Diana Whistler;Pablo Antonio Gutierrez Cubillos;Pablo Gutierrez Cubillos,80,79.25,12.407123311,98.0,39.0,1,2,1,4,6,6,9,6,11,12,22
UBCV,2017,W,ECON,326,,003,Methods of Empirical Research in Economics,Pablo Antonio Gutierrez Cubillos;Pablo Gutierrez Cubillos;Paul Schrimpf,75,75.533333333,16.527890705,100.0,0.0,3,0,2,0,3,11,7,15,17,13,4
UBCV,2017,W,ECON,390,,001,Introduction to Economic Research,Hugh Neary;Pablo Antonio Gutierrez Cubillos;Pablo Gutierrez Cubillos,43,81.930232558,9.069560153,94.0,56.0,0,0,2,1,1,1,2,6,10,12,8
UBCV,2018,S,ECON,326,,922,Methods of Empirical Research in Economics,Arkadev Ghosh;Pablo Antonio Gutierrez Cubillos;Pablo Gutierrez Cubillos;Wendy Wai Yee Kei,86,75.523255814,14.17348539,97.0,32.0,2,4,6,5,5,10,12,8,8,9,17
UBCV,2018,W,ECON,317,,002,Poverty and Inequality,David Green;Jackie Lam;Nicole Fortin;Pablo Antonio Gutierrez Cubillos;Pablo Gutierrez Cubillos,88,80.056818182,5.193625524,91.0,66.0,0,0,0,0,1,4,11,21,36,11,4
