Campus,Year,Session,Subject,Course,Detail,Section,Title,Professor,Enrolled,Avg,Std dev,High,Low,<50,50-54,55-59,60-63,64-67,68-71,72-75,76-79,80-84,85-89,90-100
UBCV,2016,W,ELEC,481,,201,Economic Analysis of Engineering Projects,Hanjun Lu;Kelleen Wiseman,100,77.45,13.50598446,96.0,0.0,2,1,2,8,6,8,12,9,13,19,20
UBCV,2017,W,CPEN,481,,201,Economic Analysis of Engineering Projects,Hanjun Lu;Kelleen Wiseman;Wei Siang Chan;Xinyue Guo;Yueshan He,70,76.471428571,13.964469851,99.0,6.0,1,1,2,6,6,8,7,2,21,4,12
UBCV,2017,W,ELEC,481,,201,Economic Analysis of Engineering Projects,Hanjun Lu;Kelleen Wiseman;Wei Siang Chan;Xinyue Guo;Yueshan He,105,79.152380952,12.57346179,100.0,50.0,0,4,2,9,8,5,10,7,20,12,28
UBCV,2017,W,FRE,385,,001,Quantitative Methods for Business and Resource Management,Hanjun Lu;Michael Johnson;Michael Roger Johnson,28,83.678571429,7.798639822,97.0,70.0,0,0,0,0,0,2,5,2,2,8,9
UBCV,2017,W,FRE,460,,001,Economics of Food Consumption,Carol Mcausland;Hanjun Lu,45,81.266666667,6.962235796,93.0,61.0,0,0,0,2,0,2,2,10,15,8,6
