Campus,Year,Session,Subject,Course,Detail,Section,Title,Professor,Enrolled,Avg,Std dev,High,Low,<50,50-54,55-59,60-63,64-67,68-71,72-75,76-79,80-84,85-89,90-100
UBCV,2016,W,CHIN,231,,001,Basic Chinese II: Part 1 (Non-Heritage),Shuang Li;Yu-Chi Kuo,27,74.11111111,9.34934524,88.0,50.0,0,1,0,2,5,2,2,7,5,3,0
UBCV,2016,W,CHIN,233,,001,Basic Chinese II: Part 2 (Non-Heritage),Shuang Li;Yu-Chi Kuo,24,75.625,9.881086457,90.0,60.0,0,0,0,5,1,2,2,5,4,4,1
UBCV,2016,W,CHIN,233,,002,Basic Chinese II: Part 2 (Non-Heritage),Qian Wang;Shuang Li,16,78.75,10.44669007,96.0,55.0,0,0,1,1,1,0,0,4,6,2,1
UBCV,2017,W,ASIA,386,,001,Chinese Grammar and Usage I,Duanduan Li;Liam Doherty;Shuang Li;Yinzong Wei,149,76.791946309,10.703166472,94.0,3.0,2,1,2,2,7,15,25,31,40,19,5
UBCV,2017,W,CHIN,401,,001,Advanced Chinese Reading and Writing I (Non-Heritage),Shuang Li;Xinxin Wu,10,80.3,3.164033993,86.0,76.0,0,0,0,0,0,0,0,3,5,2,0
UBCV,2017,W,CHIN,403,,001,Advanced Chinese Reading and Writing II (Non-Heritage),Shuang Li;Xinxin Wu;Yuanyuan. Ding,8,79.875,5.303300859,85.0,70.0,0,0,0,0,0,1,1,1,4,1,0
UBCV,2017,W,CHIN,407,,001,Advanced Chinese Speaking and Writing II (Non-Heritage),Duanduan Li;Hsiang-Ning Wang;Jiao Jiao Han;Shuang Li,13,77.307692308,6.860328167,87.0,60.0,0,0,0,1,0,0,3,4,4,1,0
UBCV,2018,S,CHIN,134,,921,Intensive Basic Chinese I (Non-Heritage),Jiao Jiao Han;Qian Wang;Shuang Li,17,77.588235294,14.146814233,93.0,35.0,1,0,1,0,0,0,3,3,3,5,1
