Campus,Year,Session,Subject,Course,Detail,Section,Title,Professor,Enrolled,Avg,Std dev,High,Low,<50,50-54,55-59,60-63,64-67,68-71,72-75,76-79,80-84,85-89,90-100,Median,Percentile (75),Percentile (25)
UBCV,2021,W,EPSE,556,,075,Cognitive and Academic Assessment Practicum,Laurie Ford;Simon Lisaingo,11,92.545454545,3.23615934,97.0,88.0,0,0,0,0,0,0,0,0,0,2,9,,,
UBCV,2021,W,EPSE,554,,074,Practicum in Cognitive Assessment,Simon Lisaingo,6,85.2,,95.0,50.0,,,,,,,,,,,,91.5,93.5,89.5
UBCV,2021,W,EPSE,556,,075,Cognitive and Academic Assessment Practicum,Laurie Ford;Simon Lisaingo,11,92.5,,97.0,88.0,,,,,,,,,,,9,92.0,95.5,90.5
UBCV,2022,W,EPSE,550,,074,"Professional, Ethical and Legal Issues in School and Applied Child Psychology",Simon Lisaingo,7,93.0,,95.0,90.0,0,0,0,0,0,0,0,0,0,0,7,94.0,94.0,92.0
UBCV,2022,W,EPSE,553,,074,Theories of Cognitive and Affective Abilities,Laurie Ford;Simon Lisaingo,13,93.6,,98.0,88.0,0,0,0,0,0,0,0,0,0,1,12,94.0,95.0,93.0
UBCV,2023,S,EPSE,583,,951,Fostering Self-Regulated Learning,Deborah Butler;Simon Lisaingo,18,95.06,,97.0,91.0,0,0,0,0,0,0,0,0,0,0,18,95.5,96.0,94.0
UBCV,2023,W,ECED,565,A,052,Special Course in Early Childhood Education,Simon Lisaingo,8,91.5,,94.0,89.0,0,0,0,0,0,0,0,0,0,2,6,92.0,92.25,90.5
