Campus,Year,Session,Subject,Course,Detail,Section,Title,Professor,Enrolled,Avg,Std dev,High,Low,<50,50-54,55-59,60-63,64-67,68-71,72-75,76-79,80-84,85-89,90-100,Median,Percentile (75),Percentile (25)
UBCV,2017,W,SOWK,405,,001,Social Work Practice II,Michelle O'Kane;Moises Escueta,45,85.2,5.04795188,95.0,69.0,0,0,0,0,0,1,0,4,16,15,9,,,
UBCV,2018,W,SOWK,201,,001,Introduction to Social Work Practice,Antoine Coulombe;Michelle O'Kane,53,84.301886792,11.146894886,95.0,20.0,1,0,0,0,1,1,3,4,11,16,16,,,
UBCV,2019,W,SOWK,201,,001,Introduction to Social Work Practice,Antoine Coulombe;Michelle O'Kane,46,83.934782609,8.577495552,97.0,37.0,1,0,0,0,0,0,1,5,17,14,8,,,
UBCV,2021,W,SOWK,420,,001,Introduction to Social Work Research,Daniel Ji;Michelle O'Kane;Sheila Marshall,55,78.472727273,8.155558308,95.0,50.0,0,1,0,0,5,3,10,8,16,9,3,,,
UBCV,2023,W,SOWK,554,C,002,Qualitative Methods in Social Work Research,Barbara Lee;Michelle O'Kane,13,85.4,,92.0,76.0,0,0,0,0,0,0,0,1,3,5,4,86.0,90.0,80.0
